{
  "schema_version": "1.0",
  "signal_id": "demo-signal-001",
  "created_at": "2026-07-01T00:00:00Z",
  "validity": {
    "date": "2026-07-01"
  },
  "territory": {
    "cell_id": "demo-001"
  },
  "production_id": "wheat_soft",
  "risk_level": "moderate",
  "headline": "Données fictives — exemple de signal",
  "summary": null,
  "evidence": [
    "demo-001"
  ],
  "ai": {
    "assisted": false,
    "template_version": null,
    "model": null
  }
}
